{
  "version": "v1",
  "metadata": {
    "name": "vad-bidirectional",
    "description": "Bidirectional audio with VAD and TTS - detects voice activity from client microphone and responds with TTS"
  },
  "nodes": [
    {
      "id": "vad",
      "node_type": "RustVADNode",
      "params": {
        "threshold": 0.5,
        "min_speech_duration_ms": 250,
        "min_silence_duration_ms": 100
      },
      "is_streaming": true
    }
  ],
  "connections": [
    {
      "from": "vad",
      "to": "kokoro_tts"
    }
  ]
}
