{
  "version": "v1",
  "metadata": {
    "name": "Whisper_Rust",
    "created_at": "2025-10-25T20:29:50.657235Z",
    "description": "Rust Whisper Pipeline"
  },
  "nodes": [
    {
      "id": "MediaReader_0",
      "node_type": "MediaReaderNode",
      "params": {
        "path": "test.wav",
        "chunk_size": 4096
      }
    },
    {
      "id": "AudioSource_1",
      "node_type": "AudioTrackSource",
      "params": {}
    },
    {
      "id": "Resample_2",
      "node_type": "AudioTransform",
      "params": {
        "output_sample_rate": 16000,
        "output_channels": 1
      }
    },
    {
      "id": "AudioBuffer_3",
      "node_type": "AudioBuffer",
      "params": {
        "buffer_size_samples": 32000
      },
      "is_streaming": true
    },
    {
      "id": "RustWhisper_4",
      "node_type": "RustWhisperTranscriber",
      "params": {
        "language": "en",
        "n_threads": 4,
        "model_source": "tiny"
      }
    }
  ],
  "connections": [
    {
      "from": "MediaReader_0",
      "to": "AudioSource_1"
    },
    {
      "from": "AudioSource_1",
      "to": "Resample_2"
    },
    {
      "from": "Resample_2",
      "to": "AudioBuffer_3"
    },
    {
      "from": "AudioBuffer_3",
      "to": "RustWhisper_4"
    }
  ]
}