{
  "version": "v1",
  "metadata": {
    "name": "wasm-test-pipeline",
    "description": "Simple test pipeline for WASM runtime validation"
  },
  "nodes": [
    {
      "id": "source_1",
      "node_type": "SimpleSource",
      "params": {
        "count": 3,
        "value": "test"
      }
    },
    {
      "id": "transform_1",
      "node_type": "UppercaseTransform",
      "params": {}
    }
  ],
  "connections": [
    {
      "from": "source_1",
      "to": "transform_1"
    }
  ]
}
